{
  "state": {
    "first_activity": "2024-08-21",
    "last_activity": "2025-03-12",
    "total_convos": 1397
  },
  "loops": [
    {
      "convo_id": "81",
      "title": "Universal Programming Table Setup",
      "score": 34490
    }
  ],
  "drift": {
    "like": 48182,
    "just": 35978,
    "execution": 35568,
    "what": 28081,
    "can": 24290,
    "system": 22367,
    "but": 22154,
    "data": 20818,
    "because": 18434,
    "people": 15670
  },
  "closure": {
    "open": 1,
    "closed": 21,
    "truly_closed": 21,
    "archived": 0,
    "ratio": 95.45,
    "closure_quality": 100.0
  }
}